{
  "version": 1,
  "name": "world_01",
  "width": 9,
  "height": 9,
  "map": [
    1,1,1,1,1,1,1,1,1,
    1,4,0,0,1,0,0,0,1,
    1,1,1,0,1,0,1,0,1,
    1,0,0,0,0,0,1,0,1,
    1,0,1,1,1,0,1,0,1,
    1,0,0,0,1,0,0,0,1,
    1,0,1,0,1,1,1,0,1,
    1,0,0,0,0,0,0,5,1,
    1,1,1,1,1,1,1,1,1
  ],
  "meta": {
    "start": { "x": 1, "y": 1 },
    "end": { "x": 7, "y": 7 },
    "seed": null,
    "seedSource": "manual"
  }
}
